premID_1,mask-type_1,hypoID_1,premise_1,hypothesis_1,orig-prob_1,model-label_1,flip-class_1,premID_2,mask-type_2,hypoID_2,premise_2,hypothesis_2,orig-prob_2,model-label_2,flip-class_2,premID_3,mask-type_3,hypoID_3,premise_3,hypothesis_3,orig-prob_3,model-label_3,flip-class_3,premID_4,mask-type_4,hypoID_4,premise_4,hypothesis_4,orig-prob_4,model-label_4,flip-class_4,premID_5,mask-type_5,hypoID_5,premise_5,hypothesis_5,orig-prob_5,model-label_5,flip-class_5
12404,content-words,64002,do you know who the guy was that was playing the uh the the wagon driver,Do you know who played the guy driving the red wagon?,1,neutral,Certain-Same,12404,content-words,64012,do you know who the guy was that was playing the uh the the wagon driver,Do you know who played the driver of the                ?,1,entailment,Uncertain-Flip,12404,original,64013,do you know who the guy was that was playing the uh the the wagon driver,Do you know who played the driver of the red wagon?,1,neutral,Certain-Same,12404,content-words,64013,do you know who the guy was that was playing the uh the the wagon driver,Do you know who played the driver of the station wagon?,1,neutral,Uncertain-Same,12404,content-words,64009,do you know who the guy was that was playing the uh the the wagon driver,Do you know who played the driver of the red?,1,entailment,Uncertain-Flip
6396,content-words,32968,The forest is thick with sissoo and tall sal trees; their timber is prized for ship-building.,The timber of oak and pine is used in car making.,0.96,contradiction,Certain-Same,6396,content-words,32966,The forest is thick with sissoo and tall sal trees; their timber is prized for ship-building.,The timber of the sissoo and sal cactus are used in car making.,0.96,contradiction,Uncertain-Same,6396,original,32953,The forest is thick with sissoo and tall sal trees; their timber is prized for ship-building.,The timber of oak and cactus are used in car making.,0.96,contradiction,Certain-Same,6396,content-words,32953,The forest is thick with sissoo and tall sal trees; their timber is prized for ship-building.,The timber of the sissoo and cactus are used in car making.,0.96,contradiction,Uncertain-Same,6396,content-words,32955,The forest is thick with sissoo and tall sal trees; their timber is prized for ship-building.,The timber from the sissoo and cactus are used in car making.,0.96,neutral,Uncertain-Flip
17454,data-slices,9638,because it's more comfortable for me but you know it's like when you're in school you either wear sweatpants or jeans,"For me it's much more comfortable. Usually when you're in school, you'll wear sweatpants.",0.95,entailment,Certain-Same,17454,data-slices,9635,because it's more comfortable for me but you know it's like when you're in school you either wear sweatpants or jeans,"For me it's. Usually when you're in school, you'll wear sweatpants.",0.95,entailment,Uncertain-Same,17454,original,9636,because it's more comfortable for me but you know it's like when you're in school you either wear sweatpants or jeans,"For me it's more comfortable. Usually when you're in school, you'll wear sweatpants.",0.95,entailment,Certain-Same,17454,data-slices,9636,because it's more comfortable for me but you know it's like when you're in school you either wear sweatpants or jeans,"For me it. Usually when you're in school, you'll wear sweatpants.",0.95,entailment,Uncertain-Same,17454,data-slices,9640,because it's more comfortable for me but you know it's like when you're in school you either wear sweatpants or jeans,"For me jeans are more comfortable. Usually when you're in school, you'll wear sweatpants.",0.95,contradiction,Uncertain-Flip
17720,gradient,51806,"Though harrowing, the second half of Boys Don't Cry isn't as great as the first.",The first half of Boys Don't Cry was better that the second.,0.99,entailment,Certain-Same,17720,gradient,51807,"Though harrowing, the second half of Boys Don't Cry isn't as great as the first.",The first half of Boys Don't Cry is as great as the second.,0.99,contradiction,Uncertain-Flip,17720,original,51803,"Though harrowing, the second half of Boys Don't Cry isn't as great as the first.",The first half of Boys Don't Cry was better than the second.,0.99,entailment,Certain-Same,17720,gradient,51803,"Though harrowing, the second half of Boys Don't Cry isn't as great as the first.",The first half of Boys Don't Cry was as great as the second.,0.99,contradiction,Uncertain-Flip,17720,gradient,51809,"Though harrowing, the second half of Boys Don't Cry isn't as great as the first.",The first half of Boys Don't Cry was better than the first second.,0.99,entailment,Uncertain-Same
5495,gradient,15430,"Tuppence, for her part, sat bolt upright much in the attitude of a watchful terrier on guard.",Tuppence had good posture and looked like she was guarded.,0.98,entailment,Certain-Flip,5495,gradient,15429,"Tuppence, for her part, sat bolt upright much in the attitude of a watchful terrier on guard.",Tuppence had good posture but she was guarded.,0.98,entailment,Uncertain-Flip,5495,original,15426,"Tuppence, for her part, sat bolt upright much in the attitude of a watchful terrier on guard.",Tuppence had good posture but only because she was guarded.,0.98,neutral,Certain-Same,5495,gradient,15426,"Tuppence, for her part, sat bolt upright much in the attitude of a watchful terrier on guard.",Tuppence had good posture because she was guarded.,0.98,neutral,Uncertain-Same,5495,gradient,15432,"Tuppence, for her part, sat bolt upright much in the attitude of a watchful terrier on guard.","Tuppence had good posture, because she was guarded.",0.98,neutral,Uncertain-Same